用户名,评分,发表时间,短评正文,赞同数量
啊吧瓦轰！,30,2021-06-27, 整部片子都太满了，情绪太外露，台词太直白生硬，配乐太多太煽情。开头的破碎更是致命的。结构上的新尝试挺有意思，让人耳目一新，但拼盘式的故事碎片最终也没能拼合出一条完整、丰满、流畅、连贯的主线，每个故事碎片都像是春晚里面经常插播的那种小短片，画面和台词都像。剪辑上玩了一些新花样，但是未免太多也太滥，反而影响观众对影片的整体把握，这种花样应该出现在B站影视区，不该出现在正片里。,1876
长得丑想得美,30,2021-07-03,实话实说，有点失望。很多“劳动者”的脸上看不到岁月苦难的皴搜的痕迹，太过整洁光鲜。有很多镜头的仪式感很重，但真实感就降低了。整部剧的运镜过于工整，贡献了很多结构唯美的分镜，但时代山河破碎的悲壮感也丧失了。不停的倒叙插叙我不太适应，整体氛围的渲染和感染力都不太够。革命有血有肉，这部电影有些浮于表面了。,1035
韩先生的电影,30,2021-07-03,把李大钊刻画的非常不立体，过于脱离生活。张颂文的表演并不出彩，把三十岁左右的守常先生塑造的老气横秋……白客、李九霄等这些角色，用的好就是点缀，用不好就是累赘……李易峰的微表情太差。,488
烈焰红唇龙,20,2021-06-26,渲染方式还是古早的主旋律如英雄儿女、上甘岭的那一套，伟光正人物配以朝霞满天和红太阳，叙事手法不断倒叙加插叙，甚至重复，导致节奏过于拖沓。张颂文和秦昊的表现没什么问题，但出现在这个有些混乱凌乱的作品中，总是显得很苍白。,1122
大海里的针,50,2021-06-27,差点看哭了，整体基调比较悲壮，除了教员登场的时候是暖色调，其他时候都是压抑的冷色调为主。那段历史是大革命失败后的至暗时刻，越是这种时刻越考验革命者的意志和灵魂。主演张颂文说自己在绞刑那场戏时看着绳子明显感到恐惧，但历史上李大钊吊了三次才断气。这是中国革命的悲情英雄，而悲情英雄往往更能打动人心。,1846
阿牛,40,2021-06-27,跟另外一部相比，以点带面用李大钊带出时代群像，更清晰与具感染力。张颂文演得好，踏实又深情。@环球港,2134
牛仔马洛,30,2021-07-01,虽然对李大钊了解不多，但在银幕前真坐不住，很想赶快回家自学历史，甚至忍不住当场（偷偷）查起资料,334
猫与竹,50,2021-07-01,本片作为“庆祝中国共产党成立100周年”重点献礼影片。有幸在第一时间看了《革命者》影片点映。该篇首度聚焦中国共产主义运动先驱李大钊的故事，全片采用独特的叙事视角，带领我们重回那段热血、动人的历史。讲述了1912至1927年间，作为中国共产主义运动的先驱、伟大的马克思主义者、杰出的无产阶级革命家、中国共产党的主要创始人之一，李大钊的革命历程。片中李大钊先生为了中国人民觉醒为了实现共产主义不停的奔走奋斗，最后至牺牲。看完内心很激动，感恩革命先烈为我们今天美好生活的付出。该片是一部了解党史，激发人们爱国、爱民、爱党的好影片。作为百年献礼影片，强烈推荐大家观看。,1193
КГБ,10,2021-07-01,"真实的他更传奇伟大，实在无需历史虚无化。
生:遗腹子，一岁半母亡。亡:第一个上绞架没有经验，受刑三次，四十分钟始绝。婚:十岁李与16岁赵结婚。
启蒙:早稻田大学政治科，受茅原A山影响接触主义。在日反袁反21条。国共和:加入国档，公告其苏裆园，第三国际身份。请愿，要求北洋政府承认苏，和其驻军外蒙。被捕:京jc突袭苏大使馆，在内抓捕李。以和苏俄通谋，里通外国罪名绞刑，时年37。",47
华盛顿樱桃树,30,2021-06-28,加入了艺术追求的类型片着实新鲜。导演对比前作我觉得有进步，故事节奏和剪辑点的创新其实更具代入感了，还挺聪明的。就是煽情部分此起彼伏密度大了点。,132
雪糕星熊,30,2021-06-27,碎 我期待的激情澎湃并没有澎湃起来 有点可惜,106
momo,20,2021-06-26,点映场。结构简洁清晰，但剪辑很乱。节奏紧张的片段戏剧性过强，反而削弱了情感表达；节奏舒缓的部分台词又太过随意，处理的很不严肃。以及选角和原音都非常不贴脸！比如让一个广东人用原音演河北人，非常出戏91总之，精神可以领会，电影拍的不够。,174
EuJ,30,2021-07-03,导演功力不够，各种转场太过于依赖动画。部分片段插入意义不明，对情节推动毫无作用。三星全给守常先生。,103
呱呱,50,2021-07-01,"诚意满满的作品讲述了李大钊同志的一生
张颂文老师yyds",549
Frau King,50,2021-06-27,【我们有主义，但也要有枪】-  革命者,739
晚安,40,2021-07-01,"我好久没有在电影院看到“八一电影制片厂”这行字了～
非常纯熟大制作的党建科普教育宣传电影，感觉是高中历史课本近代史知识点幻化成了声画影像和故事情节。影片质量很好，的确如管虎导演所说，李大钊活了三十八岁，却是普通人的三百八十年。采用交叉平行非纯线性叙事，字幕辅助来清晰地讲明白李大钊是谁做过什么，已经很不容易了。",1201
一揪棉花糖,30,2021-07-04,太碎了，刚进入一个情景马上就被拉入下一个情景了，有的台词也没感觉激动人心，反而有些尴尬,64
妖精,50,2021-07-01,就张颂文老师这种演技天花板，让我看多少遍我都愿意！《革命者》把李大钊活生生的展现在人前，他再也不是历史课本上那个伟大而光辉的先驱，而且一个有血有肉为了人民牺牲的同胞。正是这一代人的牺牲，才有了我们今天的国泰民安！,1578
豆友224150320,20,2021-07-03,镜头稀碎，让人觉得很乱。有好些地方好像广告啊？太刻意了吧！,99
伤逝,40,2021-06-28,非线性发展穿插讲了李大钊在共产党建立发展的历史事件，当然电影不是纪录片，在形式上，在美学上，这个电影，我更觉得像是导演把李大钊人生的重大历史时刻解构然后再重建了，导演和制片都注入了自己的想法，可能是为了更符合现代人的审美，影片的拍摄手法其实满摩登的，主演张颂文对李大钊的扮演，完成度也蛮高，各种时刻片段最后汇集到高潮，就是李大钊就义的时刻，气氛烘托还是可以的，现场有人看哭了（真的）。李大钊本身就值得五星了，这种为理想而献身的精神，在中国，一直都没有断过，只不过有时候被定义成不同的立场而已，愿我们都不忘初心。,1231
恋影,50,2021-06-27,首映观影，十分精彩和震撼的一部关于李大钊的自传电影。最突出的是张颂文老师对李大钊先生的诠释和演绎，我感觉到了他将自己的个人魅力和革命先辈的优秀精神品质融为一体，在影片中呈现出来，这是最令我感动的，因为张颂文做到了将自己当作是李大钊先生，一言一行，当演员真正融入到角色中，观众能够切身体会到这种力量的。我就被他演绎角色时的信仰、信心、革命精神的激情所鼓舞到，这便是这部电影不同于其他大多数影片的亮点，当他在影片中为百姓而呐喊、奋斗，我能够体会到这就是信仰的力量。影片前大半段都是用一种非线性的“意识流”手法来拍摄，将很多重要的事件和人物都串联起来，但是又不会觉得散和割裂，因为有一条主线还在，从李大钊的多种身份和各个纬度全方位来了解这位革命前辈，影片达到了它让观众产生同感和共情的效果，非常棒的献礼之作,1567
SingLesinger,50,2021-06-27,杨红雨老师的剪辑真的加了很多分。,674
豆豆瓣瓣,50,2021-07-01,"今天是最开心的一天。《革命者》首映的最后一天，有机会来看张颂文老师，激动000000
影片讲述了1927.4.26日，距离李大钊先生被执行绞刑还有38小时，此时，我党各方力量仍在积极组织对他的营救行动。守常先生一生的革命回忆，就此拉开序幕。
《革命者》这部影片太好看了，真的一点也不夸张，场景，台词，演员情绪，演技，一级棒。张颂文老师剧照跟守常先生还挺像98佟丽娅在里面也是非常棒的演技。小演员都很棒，泪点有点多啊。
我印象深刻的台词，是守常先生对大学生和工友们说的:“不希望看到人民流离失所，看到国土四分五裂，也不希望看到一代代的年轻人，老去了，麻木了，沉默了！”
革命先辈们为了中国，真的付出了非常多，无私奉献的精神值得我们学习。
影片非常非常棒，大家一定要去电影院看919191",487
VictorCai,40,2021-07-02,"问：什么是电影语言？
答：来看看《革命者》的叙事、画面和声音。",439
NL.capj,40,2021-06-27,“高尚的生活，常在壮烈的牺牲中。”法兰西共和国、苏维埃和新中国，无不有流血的英雄，李大钊是黑暗中的引路人，更是光明的见证者；意识流叙事更有人性，张颂文真正走进了角色。,295
水晶,40,2021-07-01,是一部正能量的电影，很燃很热血，张颂文演的非常棒，他赋予了李大钊善良正直谦和的一面，为了救国救民，不惜牺牲自己生命。,194
鲜肉兄,50,2021-06-27,开场不到20分钟就看哭了。意识流的拍摄方式，让时间流动了起来。看过本片我才知道，守常先生不仅会著书写字、传道受业，还会弹琴、击鼓，和农民下地干活，加上张颂文自然且放松的演技，让这位历史书上的人物丰满鲜活了很多。百年前的他们为国家抛头颅洒热血，成了世人的骄傲；活在这盛世的我们更要不辱使命，做出一番事业，让百年后的年轻人同样为我们骄傲。,542
袜子大王,40,2021-07-03,热血，但太碎片,139
放电蓝眼睛,40,2021-06-27,大胆启用年轻演员 运用了倒叙和穿插的手法 韩庚饰演了一个意想不到的人物 张颂文老师一如既往地好 整容式演技 提前观影后 分享的故事也给我很大震撼，比如李大钊在北大一个月一百八十大洋左右，家里却吃不饱饭，因为他大部分都拿出来支持革命事业和救助穷困学生。张老师坦言无法达到李先生的高度，但会一直被鼓舞。,330
巴伐利酒神,40,2021-07-01,仅从电影角度来看，还是超出了预期。尤其张颂文的表演，几乎以一己之力撑起了这部片，诠释了一个书本之外的李大钊形象：如果这还不是一个百分百的理想主义者，那还有谁是？双线叙事手法，一条线性的“行刑线”，一条非线性的“回忆线”，将李大钊和孙中山、毛泽东、蒋介石、陈独秀和张学良等人物通过一些琐事纠葛在一起，慢慢勾勒出从1916年――1927年的十年岁月中，他是如何从一个辞职的报社编辑转化为一个马克思主义者，并最终慷慨就义的。另外，影片有不少历史细节还原的不错，比如那台从意大利进口的绞刑架，和现今陈列在中国国家博物馆展览大厅里的原型一模一样，结尾蒸汽机车的彩蛋也非常有意思。,40
九把刀下魂,40,2021-07-01,通过行刑前回忆守常先生人生重要时点，见证了一位早期共产党人是如何将信仰真正发扬光大的光辉历程。虽然在至暗时刻结束，但是埋下的星辉火种已然跃跃欲试，即将照亮出一个崭新的中国。,273
花园小嗝嗝,50,2021-07-01,我从黑暗中反叛而来，却不属于未来的光明之地。为了让所有的后代能够面向光明、拥抱光明，我甘愿站在黑暗和光明的交接处，直面黑暗，甚至被黑暗吞噬。,232
吐个槽,50,2021-07-05,"很好看！值得推荐，打光场景堪比好莱坞大片。
剧情围绕大钊先生以八个人物为代表展开的故事，每个人物都很鲜活，赋予了人格魅力。让我印象最深的是青年教员扮演者李易峰，不仅形似，还神似。他出来仿佛就看到了新中国的希望！",28
希宇宝宝的小哨,50,2021-07-03,周末总是被占的打工人终于抽空看上电影了，真好看，全程泪目。比起群像型的爱国电影，还是这种更入心一些，希望将来能看到更多革命者的传记。张颂文老师，李易峰，韩庚，都太棒了，全员演技在线。就是秦昊的形象实在不太正派，可能我张东升看多了,149
Megan,30,2021-07-01,全员演技在线，张颂文台词太强了。明知有些场面是故意煽情，但眼泪还是流了下来。,79
seamouse,40,2021-07-08,当张颂文和李易峰爬上北京城楼时，一只蚊子飞到了大银幕投影上，久久不愿离去。它也相信。,23
风,50,2021-07-02,"那是一个怎么样的时代呢，心怀革命理想的人们固然可以在和家人、朋友、自己的心灵的相伴中获得许多美好和温暖，却无法忘却和置身于国家的深重忧患之外，要更多地挑起肩上的重任，为着那理想而燃烧和牺牲着自己。 

人是在自己的内心的某个被触动或是刺激的那一刻成长的。 

真正地走近和了解那个时代的时候，其实是可以触摸到非常丰富的内容和历史的。

李大钊先生是高大的，也是可亲和可爱的。如果他没有牺牲在革命的路途上，该是多么好的事。",147
suojiang,50,2021-07-01,影片结构真的很好，多视角，多线性。真的是一部高质量的献礼片！让大家看到了李大钊是一个人。李大钊、毛主席等各个人物的造型很成功：既像伟人，又能让大家看出是哪个演员。,174
momo,40,2021-07-03,守常先生短暂而又伟大的一生！01,52
今天吃铁板,50,2021-07-01,试看未来的环球，必将是赤旗的世界9899,171
sylvia,50,2021-07-01,"人是一种很神奇的生物，处于不同时代的我们可以通过电影这个媒介进行共情，虽时代不同，但我却能深切感受到中国革命者的艰辛与磨难
《革命者》，讲述了以李大钊同志为代表的中国革命者们创建新中国的努力，影片中守常先生，对中国贫弱的局面提出了自己的想法，并动员社会各个阶层，致力于中国革命
守常先生，您曾说过：“试看将来的环球，必是赤旗的世界。”先生，我们替您看到了中国光明的未来，中国的现在，已经被光明所普照。大钊先生，您的精神与山河同寿，与日月同辉，永远被我们所铭记
您成功了，这千千万万人今天所处的世界，就是您所愿望的那个新世界。这盛世，如您所愿7815",193
山和麦,40,2021-06-30,"看了点映
张颂文老师好温柔
一开头觉得剪辑节奏有点乱
但后面习惯了觉得也还好
革命真的好艰难
要调动那么多人
总有人会流血
“如果我的死能唤醒他们
那就是有意义的”
",160
郝静梧,20,2021-07-04,时间线已经不能用混乱来形容了简直是破碎  导演自己理清了吗  以至于刚刚有点感触进入情景 立马又换了一段时间叙事 情感也立马跳脱出来 看得好累 这就是导演想要的吗 是不是非得拉拉片才能真正懂为什么要这么剪啊,89
稀有电影,40,2021-07-02,"如果在黑暗时代里有一种声音足以振聋发聩，那我想一定是来自革命者悲鸣。
人民英雄的伟大，不仅在于他能消灭多少敌人，更在于他的行为能够让多少人觉醒。
那些用生命铸就的符号，永远会鲜活的跃动于这片大地，这片他们曾经最热爱的地方。张颂文正是将这份灵魂传递，生动演绎了这份千古绝唱，利用极具新意的叙事手法，重现了这段历史映象，让守常先生的音容再现，生动鲜明，可歌可泣。",23
和寂寞一起悬空,40,2021-08-28,"背黑暗而向光明，为世界遵文明，为人类造幸福。以青春之我，创建青春之国家，青春之民族。
                                                  ――李大钊",5
影随茵动,40,2021-06-27,张颂文说最初接到角色的时候没法对人物有信念感，因为无法相信世上有这样的人。后来读了大量资料后无比坚信，并且充满崇敬，以能饰演这样的角色而无上荣光。张颂文是个优秀的演员，而李大钊是个伟大的人。一部主旋律的电影，最终选择了文艺片的方式，完成了一场个人传记式的礼赞，为集体记忆重新注入一些初心，有极其打动人的一面。,12
136****7640,10,2021-08-16,一分给这个题材和伟大的革命者。,14
阿阿阿阿阿幽,40,2021-07-07,全片最打动我的点：“他们有枪”。演得很棒，而且终于意识到枪杆子里出政权91,44
非人类shang,40,2021-07-05,红色主旋律要是这样拍，总还有些新意可以看看的，剪辑和闪回这样串起一生中重要的节点与事件，表演也在线，整体值得支持和鼓励。,16
晚不安,20,2021-07-02,出乎意料地，观感比《1921》要好上一点，大抵是因为人物相对聚焦，但焦点很快又在剪辑的离心运动下被不断甩远――站在人生终点回溯过往并无不妥，只是编导空有自信而无能力掌控非线性结构，对交叉剪辑和闪回叙事几乎到了滥用的程度，最终致使时间线混乱，推动情绪高潮全靠宣传片式复读“我相信”。打上柔光，排开阵列，整齐划一高喊口号，阴险狡诈的对面是满面红光。整体看来是大型幻灯片主题演讲，重新退回主旋律造神运动的老路。,21
走钢索的墨西,30,2021-06-27,电影幸亏有了管虎的监制，否则徐展雄的这部电影会步《荞麦疯长》的后尘。但电影的闪回旁白太多，剪辑也不够流畅，两个小时的时长中途会让人有昏昏欲睡的感觉,50
偏见小姐,50,2021-07-01,这是一首属于李大钊、属于共产党人的浪漫赞歌,193
王二,20,2021-07-03,"节奏特别差台词也不好国际歌不错",52
愚钝的我,50,2021-07-01,“铁肩担道义，妙手著文章。”愿如守常先生般实践其所信，励行其所知。,141
ZOE1412,50,2021-06-28,李大钊是我没有了解的革命人物，以这样一个描述党的先驱者的角度来献党，是一个新颖又开拓民智的方向，看到过程中会怀疑真有这样的人啊，同时又觉得内心澎湃，改变需要这种看得远并且愿意为之付出的人,392
Harry,40,2021-07-03,虽然李大钊的大胡子扮相很喜感，但张颂文老师的表演感染力很强！太喜欢了！,13
风中有雨做的云,50,2021-07-01,我们生在红旗下，长在春风里。人民有信仰，国家有力量，民族有希望。目光所至皆为华夏，五星闪耀皆为信仰！愿以吾辈之青春，捍卫盛世之中华！！！,137
600_1614,50,2021-07-01,为后人谋幸福。 我相信！ 那么得真实，那么得感人。没有他们的努力，我们哪有现在美好的生活。  现代人应该多看主旋律电影。,318
梦想,50,2021-07-01,今天看哭了，这才应该是100周年该看的好电影，主演的演技都在线，让我印象最深的是李大钊和教员在城楼的那一段，是传承，是鼓舞太棒了,133
楚田水月,50,2021-07-03,"一听到国际歌的旋律就止不住流泪
在影院边看边哭边想，不好好学习，不珍惜现在所拥有的，怎么对得起牺牲的革命烈士",104
苏打气泡水,30,2021-07-04,电影本身出来的效果是好的，但剪辑过于凌乱，每个故事串起来的衔接很尴尬，背景音乐不停切换也很出戏。另外，能感受到张颂文很用力的表演，确实演的不错，很多煽情片段，但声线和李大钊也是真的不太搭。不过我也想不出谁能演好李先生了。最后说一下韩庚演的真不错。,33
cc,10,2021-08-23,很难理解 百年庆 就这？ 劣迹演员演教员 丝毫没有痕迹的面孔 拙劣的演技 真的很让人觉得在吃93 迅速补了我们的法兰西岁月洗眼睛,7
lixunhuan,30,2021-08-03,让韩庚演凯绅，结尾浓烈的广告感这种槽就不多吐了，评论献礼片的艺术价值并无意义，对我来说观看的目的和看《觉醒年代》一样，都是为了补这段历史的课。这段算是《觉醒》后中国革命的至暗时刻了，遗憾的是连叙事的基本要求都没能达到，看完全片都没搞清楚守常先生被判绞刑的具体原因，还得回来百度知乎。电影里面提到张作霖，蒋介石和李大钊之间的关系和纠葛，但是就是没有结合时局具体的说清楚这里面的利害关系。另外不知道是不是为了一定要把和教员的戏份放在压轴，时间线极其的紊乱，缺乏相关历史知识的相信会看得一头雾水。,8
genial TT,40,2021-07-02,试看将来的环球，必将是赤旗的世界！,75
y010373爻,50,2021-07-01,全片以李大钊处刑倒计时为主线 穿插着李大钊生平与业绩 叙事新颖吸睛 繁而不乱 镜头转换充满美学 革命先锋 救国心切 心中有光 不惧死亡 感情全程紧绷 感动从头至尾 张颂文演技过硬 韩庚演技也是一大亮点【北一路万达影城,10
xk,20,2021-07-25,故事讲得破碎且呆板,3
Lily蒋,40,2021-07-04,看完后，只觉得革命者，这三个字，重如千钧。,19
ynamoyerer,30,2021-08-10,首先感到张颂文的广东口音很出戏，而且他也不是特别适合这个角色。英文pioneer已经把革命意义消解或替换了。另外很不喜欢片里的照明，跟《金刚川》一样的。这电影的灯光跟《悬崖之上》很像，都不真实，很多场景不可能是灯火通明的。视觉愉悦不能以牺牲历史真实为代价，何况也不愉悦。,5
#,40,2021-07-06,李大钊值得,13
-whitecamellia,20,2021-09-09,很精致的ppt电影,4
莺莺,40,2021-07-01,从挖墓碑，李大钊距离绞刑还有38小时开始，回忆守常先生一生的革命路，原来他不仅能说会道，著书出报，还会弹钢琴击鼓，很有个人魅力，张颂文演的也很好，最后绞刑场面让人动容,223
安若Sophia,50,2021-07-01,我好喜欢这个叙事结构啊，果然浪漫主义的表达方式都如出一辙。张颂文老师在片中贡献了极为出色的表演，希望老师越来越好！,278
tangerine,40,2021-07-07,故事起于李大钊狱中景像，终于他在绞刑架上的受难行刑，电影截取了一段时光里的一些人，来还原他的人生轨迹。他不是天生的英雄，只是恰巧站在思想前列的知识分子，但历史给了他过早的结局，让他在坚守的信仰中从容赴死。影片在道具、史实方面相当考究，用侧面描写展现了一段波澜壮阔的历史，实乃一曲建党伟业的前奏。希望未来能如守常先生所说，试看将来的环球，必是赤旗的世界！,5
红鸠,20,2021-08-26,没看到演技有多好，相反整体剧情都让我感觉很尬,6
了,40,2021-08-08,现实比电影艰难一万倍，节奏、结构有点问题,8
95,40,2021-07-02,很震撼，美好的生活来之不易，祝国家繁荣昌盛,78
裁狂简,50,2021-07-02,"开篇极其有力量，堪称今年最棒的开头。
李大钊为原点的剧情漫溢开来，就是20年代的恢宏画卷。相较于群像式的多视点，这部《革》确实特别取巧，拿各色人物与守常的故事穿针引线，奉系，广东国民政府，陈独秀，髦，一层层铺垫一层层向上昂扬至开国大典的天安门。但这不正该是传记片的合理拍法吗？",91
千颂伊,40,2021-07-06,“我的生命忠于党，我的信仰光芒万丈”,18
cc_psycho,50,2021-07-01,627at万达点映 张颂文老师的演译真的很动人，感受到主创们用心，用精妙的剪辑将李大钊先生的的为革命无私献身的形象展现出来。是很独特的一部人物传记片。看的人深受感动。另韩庚的演技也不错让人刮目相看,129
闪闪珠珠,50,2021-07-04,“我从黑暗中反叛而来，却不属于未来的光明之地。为了让所有的后代能够面向光明、拥抱光明，我甘愿站在黑暗和光明的交接处，直面黑暗，甚至被黑暗吞噬。”看完泪流满面，对这位共产党人、这个男子汉肃然起敬。 ,69
-wnqqwwb,40,2021-07-06,看了两次，一次和朋友，一次和全班同学。永远不要忘记，我们永远不要忘记。,16
一个人9899,50,2021-07-06,"“试看将来的环球，必是赤旗的世界。”
大钊先生，你梦想的那个世界，我们替你们看过了，真的很棒！
电影很好看，从头哭到尾，里面每个人都演的好好呀！毛爷爷一出来，我就觉得世界都光明了，镜头运用的真的好好！绝绝子！",28
粥与文,40,2021-07-05,“如果我死了 能够唤醒那些麻木的人，能够让活着的同志们更加奋勇地前进，我可以去死”,5
一苗,50,2021-07-01,"不仅仅是一部传记片，更是一部革命浪漫主义的史诗！壮烈的牺牲才有了希望的诞生，不仅仅是一个人更是一群人！请不要叫我，请叫我们！
七一快乐，献给我亲爱的党和祖国！",248
