用户名,评分,发表时间,短评正文,赞同数量
穆豆,30,2021-08-01,各个维度上的浅，尽管在叙事结构和表现手法上努力故作深沉。,5
A-Mian,50,2021-09-20,我们要相信,0
杨三疯,30,2021-07-30,共产党人版《我想结束这一切》。李大钊是一个极其伟大、不凡长相、重要工作、家庭美满、团结奋进的人，喜欢社会活动、文学创作、政治思想，写文章创刊号、精深社会理论组建政党，帮助和唤醒的工人阶级力量，与国民党反动派斗争到底……一个深夜，受尽折磨的他独自在监狱里哼唱着国际歌，疲惫伤痛的他坐在冰冷的地板上，脑子里的一切开始混淆(经历的、虚构的、记忆的、想象的)，时间开始堆积折叠重构，他革命组党、促人奋进的共产党人的一生浮现在银幕之上，几个小时之后他被吊死在绞刑架上。,2
flyinbed,30,2021-08-08,整片风格处理偏浪漫化，形式化，并不是不可以，然以回忆闪回等组成剧情，过于零散，便显得修饰过多且无力，与影片的标题不符，其内涵和深刻性都表现不足。,0
流星主义,40,2021-07-06,整部片子想讲述的东西太多，以至于过满，我理解这样剪辑想要做到什么效果，但显然这个剪辑并没有达到理想效果。整体就是过满有点乱，属于必须聚精会神看的那类电影。但中心是好的，也能打动人，剧情没什么问题，7分吧。,24
浙一Joah,30,2021-08-27,看着片子满脑带入去中心化主义革命,0
红辣椒,50,2021-07-02,没想到国内的献礼电影也能做到兼顾艺术性了。光影，配乐，剪辑，都是奔着好电影去的。然后这个电影的选角真的很不错，就算有觉醒年代珠玉在前，张颂文的李大钊仍然形神兼备，仿佛守常先生本人。年轻演员的表现也给人惊喜，青年教员，庆子都在各自有限的戏份里给人留下了深刻的印象。电影很能给人共鸣，上一部我在电影院看哭的电影是我的姐姐，这次哭得比上次更凶。,120
Cappadocia,30,2021-07-06,他是一个共产党员，也是千千万万个共产党员！,1
张三其人,30,2021-08-29,"李易峰擦着白到发光的身子说自己是野蛮人
断断续续地演绎李大钊一生中的片段，错乱感明显，李大钊变成了一个符号（当然他也是一个符号，只不过电影里最好用现实手法把伟人还原成普通人），叙事时空蛮混乱的，配角就闪一面然后消失，丝毫不能给观众留下任何印象，",0
世o末の魔g,50,2021-07-02,喜看稻菽千重浪，遍地英雄下夕烟！,67
黑水灵坛,50,2021-10-07,中华民族的脊梁，是这些前赴后继不怕牺牲的伟人们铸造的，如今我们生活在这铮铮铁骨撑起的天地之下，当铭记历史，不忘国耻。愿以吾辈之青春，捍卫青春之国家，青春之民族，青春之未来！,0
韦恩斯坦_李,40,2021-07-30,张颂文老师演技确实很厉害，让人动容。,4
说啥呢宝贝,30,2021-07-11,设计点蛮好的，但张颂文有点假大空的意思了。,4
哈哈哈密瓜味儿,40,2021-07-06,这个电影真的很神奇…给我看睡着啦…但是醒来的时候就被打动的哭01，整个状态就是哭-迷糊睡-哭-睡-哭01张颂文演的太好了,8
海盟洋溢,30,2021-09-09,整体是合格的，满满的正能量，但是感染力明显不够，还为了明星刷脸增加了很多可有可无的小人物，可惜，,0
山,50,2021-07-04,"“守常先生，这盛世如您所愿！”
剧本结构新颖，用行刑前的数十小时来穿插整个20世纪初的革命面貌。蒋介石听戏那里看到了辛德勒名单的影子，剧本、视听、剪辑处处匹配。配乐略满但情绪非常到位了，几处泪目。
《革命者》可以说是某种程度上革新了主旋律电影的电影语言和剧作结构，大胆有新意，李大钊活起来了。强推，2021主旋律最佳！",8
哗啦啦,40,2021-07-02,诧异又兴奋!这根本就不是传统意义上的国产主旋律，而是一部优质平实的精彩纷呈的传记史诗。剧本的时间结构真是天才，让革命先驱的牺牲与其壮怀生平亦步亦趋，节奏上佳又逐级升华，不泪目是真不行。演技更不用说，张颂文的分寸感及内心戏让李大钊先生伟岸又朴实，实实在在的英烈。另说，片中蒋介石看戏段落的蒙太奇运用很&#34;教父&#34;，却如临其境，很合适。主旋律作品焕然一新，而且是刀刀见血，厉害了!,44
Leo,30,2021-08-26,高尚的生活，常在壮烈的牺牲中。,0
五月花号,40,2021-08-14,朱朝阳爸爸和张东升老师相约建党,0
尔东飞,40,2021-08-17,“将来的环球，必是赤旗的世界。”因为有人愿意为他人谋幸福，我们才学会付出，敢于付出，即便是生命！想起去年在南京雨花台看的关于李大钊和一群革命先烈的故事，至今依然热泪盈眶。当然，电影质量只值3星。,2
79LiNg64,NAN,2021-07-02,这是一段信仰之路。,21
deepsnow,40,2021-07-01,所谓一人倒下了，更多的人站起来了。前进的步伐不会停下。先烈为后代创造未来的心太伟大了。张颂文老师的表演优秀。,4
无忧逍遥,50,2021-07-01,几乎从头哭到尾，感谢这样一部诚意满满的作品，让我们能够重温守常先生的一生，能够感受这样伟大的精神力量和人格魅力。很喜欢电影的交叉叙事方式，也很喜欢电影的摄影和配乐。最喜欢最后守常先生跟教员的故事，让整个故事充满了希望！张颂文、李易峰、佟丽娅，还有演庆子等的演员都演得很不错。,7
弄尘先生,40,2021-07-02,  “先生，景山的雪纯净而柔韧，赤旗辉耀下的国家与民族至此皆幸福美满，安和乐利。放心，光明挺立的我们一定为您倾心守护好从反叛黑暗的劫途上所争斗来的一切。”与《末代皇帝》神形相似的非线性剪辑表达，让影片看似节散的叙述也始终粒粒分明，气韵饱满。当时间交杂生机，人物凝积深情，作品便可自然达到艺术与文本的高效融济。颂文老师的表现在本次亦是可圈可点。,7
Mia,40,2021-10-15,"“我从黑暗中反叛而来,却不属于未来的光明之地。我的脚踏在黑暗和光明的交锋处上,或许有一天黑暗会把我吞噬。可是为了人民,为了你们能走向光明,拥抱光明。我,我愿意去直面黑暗,因为我相信,终有一天阳光会普照整片中国大地,我坚信!”",2
扯淡的青春,50,2021-07-02,昨天看过了，电影从不同人物的视觉来展现李大钊，有些镜头拍的很绝，张老师演的李大钊也演的好，到后面国际歌一出，真的热血沸腾，还有新中国成立的镜头，红旗飘飘，每个人物都完成的很不错，印象最深是李庆天，蒋介石，毛主席的扮演者，值得大家去看,7
美人隔云端,50,2021-07-02,"“如果我的死，可以唤醒那些麻木的人们，那么我可以去死，我应该去死”

先生在狱中比鸟飞翔的时候真的泪奔，整部电影悲壮又浪漫，感谢那个时代所有了不起的革命者们，今日的中国，遍地都是赤旗。",4
sunking,20,2021-08-16,这种主旋律的电影一定要拍出历史的厚重感，要有煽动性，感染力，所谓的特效，鲜肉，场面（参考建国大业）都只是点缀或者烘托作用，首先导演要讲一个好故事，如果讲故事能力不行，其他的都白费。本来很好个题材，导演好像也很喜欢炫技，三分钟一个倒叙两分钟一个插叙加上无数个蒙太奇，你又不是拍悬疑片，扯这些没用的干什么？,1
翟天临,50,2021-07-03,呜呜呜守常先生，我相信,3
少翘二郎腿,50,2021-07-03,"“他们手里都有枪……我们没有……”李大钊先生说出这句话的时候是我感到最无力的时刻，是的，他们手里有枪，但是枪口不是向着敌人，反而是向着自己的爱国同胞们，是向着满腔热血的赤诚国人啊01
于是想到以后的那句“枪杆子里出政权”，教员说的太对了！守常到润之，是薪火相传生生不息啊",23
通叔,40,2021-09-21,他的后来者们，让中国好起来了,2
落小木,40,2021-07-21,破碎的叙事全靠张颂文的表演来撑...眼泪也为你流...不要说我们一无所有，我们要做天下的主人...,3
天道有常,40,2021-11-05,以人物群像来插叙  各自有各自的回忆  有张学良的 有蒋介石的 有李大钊妻子的 也有其他角色人物的 这不是按照时间线来拍摄的影片 ！各种散乱的 支离的 镜头拼凑起来了这部电影，镜头形式可以，里面内情无感，但无论如何比起1921好，革命仍在持续且应当一直要持续。,4
匣中猫,40,2021-07-01,比想象中的好，杨红雨操刀的非线性剪辑叙事，大胆且还算完备，在开头20分钟的不适应后渐入佳境。学生、爱人、对手、同志……多重视角，几大事件，像是李大钊人生的切片，解构这个人物多面性的同时，也用群像线索组成了那个充满着血泪的“至暗时刻”。比起“李大钊传”，更像是“他人眼中的理想主义者”，故事到达结尾，英雄牺牲，理想星芒却未因此陡然消散，而散布到许多的“布尔什维克”的心中，那些像火种一般熊熊燃烧的理想，仍是这时代需要的赤诚。3.5归4。,0
水青蛙,50,2021-07-03,"   我是前天晚上抽时间去的，看完真的觉得电影比预期的好看，一开始就把整个节奏拉入了低沉，那时候的中国老百姓真是命如草芥啊，人命就像蚂蚁一样能随意被人践踏啊～
   印象比较深的就是蒋介石的戏份出来那个眼神是真的冷到我了，那个眼神阴冷得不寒而栗，演员演技真的挺好，挺惊喜的。后面登景山那里一缕阳光出来，整个影片色调有彩色了，明亮了，让人看到了革命者的希望，最后李大钊先生一步一步走向断头台的时候哭了～张颂文老师演得真的好好，全员演技都在线，感谢生在盛世！
",82
萌新小蜜糖,50,2021-07-04,"张颂文老师太优秀了 939993999399所有角色都很棒 看的时候才意外发现还有宋茜 
李庆天 和报童 张学良都让人印象深刻

李易峰诠释的也很好 毛主席出现的时候 就好像真的看到了希望和光 台词坚定有力 意气风发 民族的希望哇 
 虽然短短10分钟不到 可是却让人印象深刻 
真的很优秀 一点不会跳戏 939993999399
【台词燃爆了】 感受下
“这里的每一寸土地都是中国的！”
“我可以去死 我应该去死”
“为天下人谋幸福 才是真正的大事”
“我有一个愿望 当我再回到这里 整个北京城已经插满了红旗”
“试看将来的环球 必是赤旗的天下！”
…… 
电影结束后看完就想鼓掌 听到歌就想跟着唱9899 
一切如您所愿9899 9899 9899 
我们替您看见了 7815 守常先生",27
长河吟Ev_,40,2021-09-25,像一部加长版mv，但这还重要吗？我们胜利了，国家也富强了，您如果想看这个新中国，我们都是您的眼睛。,0
竹海苡,50,2021-07-04,给五星的原因，因为他们是革命者，他们是先驱，是他们探索出救中国的道路，也是他们用自己所学，用信仰，用生命带给了这个国家希望，带给了人民希望。这盛世如他们所愿，可是他们看不到了,32
影子不用手,40,2021-08-23,这样的革命历史题材，无论从哪个角度，无论用哪种手法，很难不让人动情。,1
电影上言君,50,2021-08-13,李大钊先生您胜了，这盛世如您所愿。伟大的中国9899，我骄傲，电影感动到哭，革命不易，年轻人要珍惜幸福生活。,2
轻风羽,40,2021-08-26,本片被诟病的叙事方式，我的观感却是极好的，刑房中的折磨与回忆中的经历交错叙事，像是黑暗与光明的交织，这能让人联想到革命先烈们是如何挺过黑暗的，因为他们经历过希望的实现、有过可信任的的同路人、撒下过有生命力的火种，所以他们相信光明一定会到来。本片是近年来同类题材中台词最好的一部了，这是优点也是缺点，对于本来就被感召的我来说，这些台词让人热泪盈眶，但对于还在懵懂的青年来说，本片的情节与情感渲染不足以支撑台词，这也是我们在宣传方面一直力有不逮的地方。,1
四月物语,30,2021-08-13,李大钊牺牲时才38岁……,0
于成,30,2021-08-19,结构不错，几处细节挺有意思。字幕堆积的历史背景、语焉不详的人物关系、眼花缭乱的明星客串、结尾穿插的旗帜影像，也注定了它的超文本性。,0
皮皮电影,40,2021-07-02,特意去网上考证了“挖墓碑”这件事，确实真实存在，沉埋地下50年的墓碑，力量感很足。,2
明月 花枝 你,50,2021-07-03,开头就泪目。在我上一次看《十六年前的回忆》时，尚没有这么深的感触。现在却感觉，那个流血流泪的人就在我眼前。充满力量，坚守初心，至少我该做好我能做的。,4
用户名,评分,发表时间,短评正文,赞同数量
阿牛,40,2021-06-27,跟另外一部相比，以点带面用李大钊带出时代群像，更清晰与具感染力。张颂文演得好，踏实又深情。@环球港,2227
啊吧瓦轰！,30,2021-06-27, 整部片子都太满了，情绪太外露，台词太直白生硬，配乐太多太煽情。开头的破碎更是致命的。结构上的新尝试挺有意思，让人耳目一新，但拼盘式的故事碎片最终也没能拼合出一条完整、丰满、流畅、连贯的主线，每个故事碎片都像是春晚里面经常插播的那种小短片，画面和台词都像。剪辑上玩了一些新花样，但是未免太多也太滥，反而影响观众对影片的整体把握，这种花样应该出现在B站影视区，不该出现在正片里。,1939
长得丑想得美,30,2021-07-03,实话实说，有点失望。很多“劳动者”的脸上看不到岁月苦难的皴搜的痕迹，太过整洁光鲜。有很多镜头的仪式感很重，但真实感就降低了。整部剧的运镜过于工整，贡献了很多结构唯美的分镜，但时代山河破碎的悲壮感也丧失了。不停的倒叙插叙我不太适应，整体氛围的渲染和感染力都不太够。革命有血有肉，这部电影有些浮于表面了。,1111
晚安,40,2021-07-01,"我好久没有在电影院看到“八一电影制片厂”这行字了～
非常纯熟大制作的党建科普教育宣传电影，感觉是高中历史课本近代史知识点幻化成了声画影像和故事情节。影片质量很好，的确如管虎导演所说，李大钊活了三十八岁，却是普通人的三百八十年。采用交叉平行非纯线性叙事，字幕辅助来清晰地讲明白李大钊是谁做过什么，已经很不容易了。",1221
韩先生的电影,30,2021-07-03,把李大钊刻画的非常不立体，过于脱离生活。张颂文的表演并不出彩，把三十岁左右的守常先生塑造的老气横秋……白客、李九霄等这些角色，用的好就是点缀，用不好就是累赘……李易峰的微表情太差。,532
牛仔马洛,30,2021-07-01,虽然对李大钊了解不多，但在银幕前真坐不住，很想赶快回家自学历史，甚至忍不住当场（偷偷）查起资料,351
大海里的针,50,2021-06-27,差点看哭了，整体基调比较悲壮，除了教员登场的时候是暖色调，其他时候都是压抑的冷色调为主。那段历史是大革命失败后的至暗时刻，越是这种时刻越考验革命者的意志和灵魂。主演张颂文说自己在绞刑那场戏时看着绳子明显感到恐惧，但历史上李大钊吊了三次才断气。这是中国革命的悲情英雄，而悲情英雄往往更能打动人心。,1858
华盛顿樱桃树,30,2021-06-28,加入了艺术追求的类型片着实新鲜。导演对比前作我觉得有进步，故事节奏和剪辑点的创新其实更具代入感了，还挺聪明的。就是煽情部分此起彼伏密度大了点。,135
雪糕星熊,30,2021-06-27,碎 我期待的激情澎湃并没有澎湃起来 有点可惜,110
VictorCai,40,2021-07-02,"问：什么是电影语言？
答：来看看《革命者》的叙事、画面和声音。",466
EuJ,30,2021-07-03,导演功力不够，各种转场太过于依赖动画。部分片段插入意义不明，对情节推动毫无作用。三星全给守常先生。,112
一揪棉花糖,30,2021-07-04,太碎了，刚进入一个情景马上就被拉入下一个情景了，有的台词也没感觉激动人心，反而有些尴尬,65
袜子大王,40,2021-07-03,热血，但太碎片,142
走钢索的墨西,30,2021-06-27,电影幸亏有了管虎的监制，否则徐展雄的这部电影会步《荞麦疯长》的后尘。但电影的闪回旁白太多，剪辑也不够流畅，两个小时的时长中途会让人有昏昏欲睡的感觉,51
猫与竹,50,2021-07-01,本片作为“庆祝中国共产党成立100周年”重点献礼影片。有幸在第一时间看了《革命者》影片点映。该篇首度聚焦中国共产主义运动先驱李大钊的故事，全片采用独特的叙事视角，带领我们重回那段热血、动人的历史。讲述了1912至1927年间，作为中国共产主义运动的先驱、伟大的马克思主义者、杰出的无产阶级革命家、中国共产党的主要创始人之一，李大钊的革命历程。片中李大钊先生为了中国人民觉醒为了实现共产主义不停的奔走奋斗，最后至牺牲。看完内心很激动，感恩革命先烈为我们今天美好生活的付出。该片是一部了解党史，激发人们爱国、爱民、爱党的好影片。作为百年献礼影片，强烈推荐大家观看。,1195
放电蓝眼睛,40,2021-06-27,大胆启用年轻演员 运用了倒叙和穿插的手法 韩庚饰演了一个意想不到的人物 张颂文老师一如既往地好 整容式演技 提前观影后 分享的故事也给我很大震撼，比如李大钊在北大一个月一百八十大洋左右，家里却吃不饱饭，因为他大部分都拿出来支持革命事业和救助穷困学生。张老师坦言无法达到李先生的高度，但会一直被鼓舞。,343
烈焰红唇龙,20,2021-06-26,渲染方式还是古早的主旋律如英雄儿女、上甘岭的那一套，伟光正人物配以朝霞满天和红太阳，叙事手法不断倒叙加插叙，甚至重复，导致节奏过于拖沓。张颂文和秦昊的表现没什么问题，但出现在这个有些混乱凌乱的作品中，总是显得很苍白。,1160
NL.capj,40,2021-06-27,“高尚的生活，常在壮烈的牺牲中。”法兰西共和国、苏维埃和新中国，无不有流血的英雄，李大钊是黑暗中的引路人，更是光明的见证者；意识流叙事更有人性，张颂文真正走进了角色。,308
momo,20,2021-06-26,点映场。结构简洁清晰，但剪辑很乱。节奏紧张的片段戏剧性过强，反而削弱了情感表达；节奏舒缓的部分台词又太过随意，处理的很不严肃。以及选角和原音都非常不贴脸！比如让一个广东人用原音演河北人，非常出戏91总之，精神可以领会，电影拍的不够。,180
Megan,30,2021-07-01,全员演技在线，张颂文台词太强了。明知有些场面是故意煽情，但眼泪还是流了下来。,90
孔府小鱼,30,2021-07-01,7.8，这个片子似乎在主旋律电影里找到了一种很特别表现方法，因为历史已经为人熟知，所以电影放弃了线性的叙事，反而使用倒叙和插叙，开篇是李大钊行刑前的生命倒计时，片段化地穿插表现李大钊人生不同阶段遇到的人与事，大量的蒙太奇效果，而且也用到了慢镜头的打斗冲突和常速的演讲交叉剪辑，而很多场景是十分写意的，切的一些局部构图不错，加上独白的运用，解决了纯历史片平铺直叙容易造成的疲乏感。总体上说，这部是干脆选择了浪漫主义，反而是其别致的地方所在。,3
巴伐利酒神,40,2021-07-01,仅从电影角度来看，还是超出了预期。尤其张颂文的表演，几乎以一己之力撑起了这部片，诠释了一个书本之外的李大钊形象：如果这还不是一个百分百的理想主义者，那还有谁是？双线叙事手法，一条线性的“行刑线”，一条非线性的“回忆线”，将李大钊和孙中山、毛泽东、蒋介石、陈独秀和张学良等人物通过一些琐事纠葛在一起，慢慢勾勒出从1916年――1927年的十年岁月中，他是如何从一个辞职的报社编辑转化为一个马克思主义者，并最终慷慨就义的。另外，影片有不少历史细节还原的不错，比如那台从意大利进口的绞刑架，和现今陈列在中国国家博物馆展览大厅里的原型一模一样，结尾蒸汽机车的彩蛋也非常有意思。,50
momo,40,2021-07-03,守常先生短暂而又伟大的一生！01,55
水晶,40,2021-07-01,是一部正能量的电影，很燃很热血，张颂文演的非常棒，他赋予了李大钊善良正直谦和的一面，为了救国救民，不惜牺牲自己生命。,203
Frau King,50,2021-06-27,【我们有主义，但也要有枪】-  革命者,743
seamouse,40,2021-07-08,当张颂文和李易峰爬上北京城楼时，一只蚊子飞到了大银幕投影上，久久不愿离去。它也相信。,28
山和麦,40,2021-06-30,"看了点映
张颂文老师好温柔
一开头觉得剪辑节奏有点乱
但后面习惯了觉得也还好
革命真的好艰难
要调动那么多人
总有人会流血
“如果我的死能唤醒他们
那就是有意义的”
",165
头像是凯蒂猫,30,2021-07-04,电影本身出来的效果是好的，但剪辑过于凌乱，每个故事串起来的衔接很尴尬，背景音乐不停切换也很出戏。另外，能感受到张颂文很用力的表演，确实演的不错，很多煽情片段，但声线和李大钊也是真的不太搭。不过我也想不出谁能演好李先生了。最后说一下韩庚演的真不错。,33
稀有电影,40,2021-07-02,"如果在黑暗时代里有一种声音足以振聋发聩，那我想一定是来自革命者悲鸣。
人民英雄的伟大，不仅在于他能消灭多少敌人，更在于他的行为能够让多少人觉醒。
那些用生命铸就的符号，永远会鲜活的跃动于这片大地，这片他们曾经最热爱的地方。张颂文正是将这份灵魂传递，生动演绎了这份千古绝唱，利用极具新意的叙事手法，重现了这段历史映象，让守常先生的音容再现，生动鲜明，可歌可泣。",26
КГБ,10,2021-07-01,"真实的他更传奇伟大，实在无需历史虚无化。
生:遗腹子，一岁半母亡。亡:第一个上绞架没有经验，受刑三次，四十分钟始绝。婚:十岁李与16岁赵结婚。
启蒙:早稻田大学政治科，受茅原A山影响接触主义。在日反袁反21条。国共和:加入国档，公告其苏裆园，第三国际身份。请愿，要求北洋政府承认苏，和其驻军外蒙。被捕:京jc突袭苏大使馆，在内抓捕李。以和苏俄通谋，里通外国罪名绞刑，时年37。",55
恋影,50,2021-06-27,首映观影，十分精彩和震撼的一部关于李大钊的自传电影。最突出的是张颂文老师对李大钊先生的诠释和演绎，我感觉到了他将自己的个人魅力和革命先辈的优秀精神品质融为一体，在影片中呈现出来，这是最令我感动的，因为张颂文做到了将自己当作是李大钊先生，一言一行，当演员真正融入到角色中，观众能够切身体会到这种力量的。我就被他演绎角色时的信仰、信心、革命精神的激情所鼓舞到，这便是这部电影不同于其他大多数影片的亮点，当他在影片中为百姓而呐喊、奋斗，我能够体会到这就是信仰的力量。影片前大半段都是用一种非线性的“意识流”手法来拍摄，将很多重要的事件和人物都串联起来，但是又不会觉得散和割裂，因为有一条主线还在，从李大钊的多种身份和各个纬度全方位来了解这位革命前辈，影片达到了它让观众产生同感和共情的效果，非常棒的献礼之作,1586
妖精,50,2021-07-01,就张颂文老师这种演技天花板，让我看多少遍我都愿意！《革命者》把李大钊活生生的展现在人前，他再也不是历史课本上那个伟大而光辉的先驱，而且一个有血有肉为了人民牺牲的同胞。正是这一代人的牺牲，才有了我们今天的国泰民安！,1603
lixunhuan,30,2021-08-03,让韩庚演凯绅，结尾浓烈的广告感这种槽就不多吐了，评论献礼片的艺术价值并无意义，对我来说观看的目的和看《觉醒年代》一样，都是为了补这段历史的课。这段算是《觉醒》后中国革命的至暗时刻了，遗憾的是连叙事的基本要求都没能达到，看完全片都没搞清楚守常先生被判绞刑的具体原因，还得回来百度知乎。电影里面提到张作霖，蒋介石和李大钊之间的关系和纠葛，但是就是没有结合时局具体的说清楚这里面的利害关系。另外不知道是不是为了一定要把和教员的戏份放在压轴，时间线极其的紊乱，缺乏相关历史知识的相信会看得一头雾水。,8
豆友224150320,20,2021-07-03,镜头稀碎，让人觉得很乱。有好些地方好像广告啊？太刻意了吧！,99
